{
  "schemaVersion": "1.0.0",
  "dataset": {
    "mode": "fixture",
    "label": "SYNTHETIC FIXTURE — NOT MARKET DATA",
    "freshness": "fixture / unknown",
    "sessionCalendar": "unverified"
  },
  "assets": [
    {
      "assetId": "VN:HOSE:FPT",
      "symbol": "FPT",
      "assetType": "equity",
      "exchange": "HOSE",
      "currency": "VND",
      "unit": "VND",
      "timezone": "Asia/Ho_Chi_Minh"
    },
    {
      "assetId": "VN:HOSE:VCB",
      "symbol": "VCB",
      "assetType": "equity",
      "exchange": "HOSE",
      "currency": "VND",
      "unit": "VND",
      "timezone": "Asia/Ho_Chi_Minh"
    },
    {
      "assetId": "VN:HOSE:HPG",
      "symbol": "HPG",
      "assetType": "equity",
      "exchange": "HOSE",
      "currency": "VND",
      "unit": "VND",
      "timezone": "Asia/Ho_Chi_Minh"
    },
    {
      "assetId": "VN:HOSE:VNM",
      "symbol": "VNM",
      "assetType": "equity",
      "exchange": "HOSE",
      "currency": "VND",
      "unit": "VND",
      "timezone": "Asia/Ho_Chi_Minh"
    },
    {
      "assetId": "VN:HOSE:SSI",
      "symbol": "SSI",
      "assetType": "equity",
      "exchange": "HOSE",
      "currency": "VND",
      "unit": "VND",
      "timezone": "Asia/Ho_Chi_Minh"
    },
    {
      "assetId": "VN:HOSE:VIC",
      "symbol": "VIC",
      "assetType": "equity",
      "exchange": "HOSE",
      "currency": "VND",
      "unit": "VND",
      "timezone": "Asia/Ho_Chi_Minh"
    },
    {
      "assetId": "VN:HOSE:VHM",
      "symbol": "VHM",
      "assetType": "equity",
      "exchange": "HOSE",
      "currency": "VND",
      "unit": "VND",
      "timezone": "Asia/Ho_Chi_Minh"
    },
    {
      "assetId": "VN:HOSE:MSN",
      "symbol": "MSN",
      "assetType": "equity",
      "exchange": "HOSE",
      "currency": "VND",
      "unit": "VND",
      "timezone": "Asia/Ho_Chi_Minh"
    },
    {
      "assetId": "VN:HOSE:MWG",
      "symbol": "MWG",
      "assetType": "equity",
      "exchange": "HOSE",
      "currency": "VND",
      "unit": "VND",
      "timezone": "Asia/Ho_Chi_Minh"
    },
    {
      "assetId": "VN:HOSE:BID",
      "symbol": "BID",
      "assetType": "equity",
      "exchange": "HOSE",
      "currency": "VND",
      "unit": "VND",
      "timezone": "Asia/Ho_Chi_Minh"
    },
    {
      "assetId": "VN:INDEX:VNINDEX",
      "symbol": "VNINDEX",
      "assetType": "index",
      "exchange": "INDEX",
      "currency": null,
      "unit": "index_point",
      "timezone": "Asia/Ho_Chi_Minh"
    }
  ],
  "candles": [
    {
      "assetId": "VN:HOSE:FPT",
      "tradingDate": "2026-09-21",
      "currency": "VND",
      "unit": "VND",
      "adjustmentBasis": "unadjusted",
      "timezone": "Asia/Ho_Chi_Minh",
      "asOf": "2026-09-21T15:00:00+07:00",
      "ingestedAt": "2026-09-21T15:05:00+07:00",
      "source": {
        "provider": "marketpulse-fixture",
        "mode": "fixture",
        "recordId": "synthetic-FPT-2026-09-21"
      },
      "interval": "1d",
      "open": 100050,
      "high": 100250,
      "low": 99900,
      "close": 100000,
      "volume": 1000000,
      "volumeUnit": "shares"
    },
    {
      "assetId": "VN:HOSE:FPT",
      "tradingDate": "2026-09-22",
      "currency": "VND",
      "unit": "VND",
      "adjustmentBasis": "unadjusted",
      "timezone": "Asia/Ho_Chi_Minh",
      "asOf": "2026-09-22T15:00:00+07:00",
      "ingestedAt": "2026-09-22T15:05:00+07:00",
      "source": {
        "provider": "marketpulse-fixture",
        "mode": "fixture",
        "recordId": "synthetic-FPT-2026-09-22"
      },
      "interval": "1d",
      "open": 100950,
      "high": 101200,
      "low": 100850,
      "close": 101000,
      "volume": 1010000,
      "volumeUnit": "shares"
    },
    {
      "assetId": "VN:HOSE:FPT",
      "tradingDate": "2026-09-23",
      "currency": "VND",
      "unit": "VND",
      "adjustmentBasis": "unadjusted",
      "timezone": "Asia/Ho_Chi_Minh",
      "asOf": "2026-09-23T15:00:00+07:00",
      "ingestedAt": "2026-09-23T15:05:00+07:00",
      "source": {
        "provider": "marketpulse-fixture",
        "mode": "fixture",
        "recordId": "synthetic-FPT-2026-09-23"
      },
      "interval": "1d",
      "open": 102550,
      "high": 102750,
      "low": 102400,
      "close": 102500,
      "volume": 1020000,
      "volumeUnit": "shares"
    },
    {
      "assetId": "VN:HOSE:VCB",
      "tradingDate": "2026-09-21",
      "currency": "VND",
      "unit": "VND",
      "adjustmentBasis": "unadjusted",
      "timezone": "Asia/Ho_Chi_Minh",
      "asOf": "2026-09-21T15:00:00+07:00",
      "ingestedAt": "2026-09-21T15:05:00+07:00",
      "source": {
        "provider": "marketpulse-fixture",
        "mode": "fixture",
        "recordId": "synthetic-VCB-2026-09-21"
      },
      "interval": "1d",
      "open": 90050,
      "high": 90250,
      "low": 89900,
      "close": 90000,
      "volume": 1001000,
      "volumeUnit": "shares"
    },
    {
      "assetId": "VN:HOSE:VCB",
      "tradingDate": "2026-09-22",
      "currency": "VND",
      "unit": "VND",
      "adjustmentBasis": "unadjusted",
      "timezone": "Asia/Ho_Chi_Minh",
      "asOf": "2026-09-22T15:00:00+07:00",
      "ingestedAt": "2026-09-22T15:05:00+07:00",
      "source": {
        "provider": "marketpulse-fixture",
        "mode": "fixture",
        "recordId": "synthetic-VCB-2026-09-22"
      },
      "interval": "1d",
      "open": 89450,
      "high": 89700,
      "low": 89350,
      "close": 89500,
      "volume": 1011000,
      "volumeUnit": "shares"
    },
    {
      "assetId": "VN:HOSE:VCB",
      "tradingDate": "2026-09-23",
      "currency": "VND",
      "unit": "VND",
      "adjustmentBasis": "unadjusted",
      "timezone": "Asia/Ho_Chi_Minh",
      "asOf": "2026-09-23T15:00:00+07:00",
      "ingestedAt": "2026-09-23T15:05:00+07:00",
      "source": {
        "provider": "marketpulse-fixture",
        "mode": "fixture",
        "recordId": "synthetic-VCB-2026-09-23"
      },
      "interval": "1d",
      "open": 91050,
      "high": 91250,
      "low": 90900,
      "close": 91000,
      "volume": 1021000,
      "volumeUnit": "shares"
    },
    {
      "assetId": "VN:HOSE:HPG",
      "tradingDate": "2026-09-21",
      "currency": "VND",
      "unit": "VND",
      "adjustmentBasis": "unadjusted",
      "timezone": "Asia/Ho_Chi_Minh",
      "asOf": "2026-09-21T15:00:00+07:00",
      "ingestedAt": "2026-09-21T15:05:00+07:00",
      "source": {
        "provider": "marketpulse-fixture",
        "mode": "fixture",
        "recordId": "synthetic-HPG-2026-09-21"
      },
      "interval": "1d",
      "open": 25050,
      "high": 25250,
      "low": 24900,
      "close": 25000,
      "volume": 1002000,
      "volumeUnit": "shares"
    },
    {
      "assetId": "VN:HOSE:HPG",
      "tradingDate": "2026-09-22",
      "currency": "VND",
      "unit": "VND",
      "adjustmentBasis": "unadjusted",
      "timezone": "Asia/Ho_Chi_Minh",
      "asOf": "2026-09-22T15:00:00+07:00",
      "ingestedAt": "2026-09-22T15:05:00+07:00",
      "source": {
        "provider": "marketpulse-fixture",
        "mode": "fixture",
        "recordId": "synthetic-HPG-2026-09-22"
      },
      "interval": "1d",
      "open": 25450,
      "high": 25700,
      "low": 25350,
      "close": 25500,
      "volume": 1012000,
      "volumeUnit": "shares"
    },
    {
      "assetId": "VN:HOSE:HPG",
      "tradingDate": "2026-09-23",
      "currency": "VND",
      "unit": "VND",
      "adjustmentBasis": "unadjusted",
      "timezone": "Asia/Ho_Chi_Minh",
      "asOf": "2026-09-23T15:00:00+07:00",
      "ingestedAt": "2026-09-23T15:05:00+07:00",
      "source": {
        "provider": "marketpulse-fixture",
        "mode": "fixture",
        "recordId": "synthetic-HPG-2026-09-23"
      },
      "interval": "1d",
      "open": 25250,
      "high": 25450,
      "low": 25100,
      "close": 25200,
      "volume": 1022000,
      "volumeUnit": "shares"
    },
    {
      "assetId": "VN:HOSE:VNM",
      "tradingDate": "2026-09-21",
      "currency": "VND",
      "unit": "VND",
      "adjustmentBasis": "unadjusted",
      "timezone": "Asia/Ho_Chi_Minh",
      "asOf": "2026-09-21T15:00:00+07:00",
      "ingestedAt": "2026-09-21T15:05:00+07:00",
      "source": {
        "provider": "marketpulse-fixture",
        "mode": "fixture",
        "recordId": "synthetic-VNM-2026-09-21"
      },
      "interval": "1d",
      "open": 65050,
      "high": 65250,
      "low": 64900,
      "close": 65000,
      "volume": 1003000,
      "volumeUnit": "shares"
    },
    {
      "assetId": "VN:HOSE:VNM",
      "tradingDate": "2026-09-22",
      "currency": "VND",
      "unit": "VND",
      "adjustmentBasis": "unadjusted",
      "timezone": "Asia/Ho_Chi_Minh",
      "asOf": "2026-09-22T15:00:00+07:00",
      "ingestedAt": "2026-09-22T15:05:00+07:00",
      "source": {
        "provider": "marketpulse-fixture",
        "mode": "fixture",
        "recordId": "synthetic-VNM-2026-09-22"
      },
      "interval": "1d",
      "open": 65050,
      "high": 65300,
      "low": 64950,
      "close": 65100,
      "volume": 1013000,
      "volumeUnit": "shares"
    },
    {
      "assetId": "VN:HOSE:VNM",
      "tradingDate": "2026-09-23",
      "currency": "VND",
      "unit": "VND",
      "adjustmentBasis": "unadjusted",
      "timezone": "Asia/Ho_Chi_Minh",
      "asOf": "2026-09-23T15:00:00+07:00",
      "ingestedAt": "2026-09-23T15:05:00+07:00",
      "source": {
        "provider": "marketpulse-fixture",
        "mode": "fixture",
        "recordId": "synthetic-VNM-2026-09-23"
      },
      "interval": "1d",
      "open": 64850,
      "high": 65050,
      "low": 64700,
      "close": 64800,
      "volume": 1023000,
      "volumeUnit": "shares"
    },
    {
      "assetId": "VN:HOSE:SSI",
      "tradingDate": "2026-09-21",
      "currency": "VND",
      "unit": "VND",
      "adjustmentBasis": "unadjusted",
      "timezone": "Asia/Ho_Chi_Minh",
      "asOf": "2026-09-21T15:00:00+07:00",